{
  "_sample": true,
  "type": "FeatureCollection",
  "speed": 0.8,
  "radius_m": 300,
  "features": [
    {
      "type": "Feature",
      "geometry": {
        "type": "Point",
        "coordinates": [
          129.133787,
          35.169486
        ]
      },
      "properties": {
        "cw_id": "SAMPLE-21090740-C1",
        "adm_cd": "21090740",
        "gap_s": 6.7,
        "exposure_cnt": 2
      }
    },
    {
      "type": "Feature",
      "geometry": {
        "type": "Point",
        "coordinates": [
          129.134291,
          35.164313
        ]
      },
      "properties": {
        "cw_id": "SAMPLE-21090740-C2",
        "adm_cd": "21090740",
        "gap_s": 3.8,
        "exposure_cnt": 1
      }
    },
    {
      "type": "Feature",
      "geometry": {
        "type": "Point",
        "coordinates": [
          129.133887,
          35.168502
        ]
      },
      "properties": {
        "cw_id": "SAMPLE-21090740-C3",
        "adm_cd": "21090740",
        "gap_s": 2.7,
        "exposure_cnt": 3
      }
    },
    {
      "type": "Feature",
      "geometry": {
        "type": "Point",
        "coordinates": [
          129.171354,
          35.16144
        ]
      },
      "properties": {
        "cw_id": "SAMPLE-21090530-C1",
        "adm_cd": "21090530",
        "gap_s": 6.9,
        "exposure_cnt": 1
      }
    },
    {
      "type": "Feature",
      "geometry": {
        "type": "Point",
        "coordinates": [
          129.18208,
          35.158827
        ]
      },
      "properties": {
        "cw_id": "SAMPLE-21090540-C1",
        "adm_cd": "21090540",
        "gap_s": 3.5,
        "exposure_cnt": 3
      }
    },
    {
      "type": "Feature",
      "geometry": {
        "type": "Point",
        "coordinates": [
          129.184674,
          35.162661
        ]
      },
      "properties": {
        "cw_id": "SAMPLE-21090540-C2",
        "adm_cd": "21090540",
        "gap_s": 2.6,
        "exposure_cnt": 3
      }
    },
    {
      "type": "Feature",
      "geometry": {
        "type": "Point",
        "coordinates": [
          129.18358,
          35.161559
        ]
      },
      "properties": {
        "cw_id": "SAMPLE-21090540-C3",
        "adm_cd": "21090540",
        "gap_s": 4.5,
        "exposure_cnt": 3
      }
    },
    {
      "type": "Feature",
      "geometry": {
        "type": "Point",
        "coordinates": [
          129.134969,
          35.19474
        ]
      },
      "properties": {
        "cw_id": "SAMPLE-21090580-C1",
        "adm_cd": "21090580",
        "gap_s": 4.7,
        "exposure_cnt": 1
      }
    },
    {
      "type": "Feature",
      "geometry": {
        "type": "Point",
        "coordinates": [
          129.133536,
          35.193271
        ]
      },
      "properties": {
        "cw_id": "SAMPLE-21090580-C2",
        "adm_cd": "21090580",
        "gap_s": 4,
        "exposure_cnt": 3
      }
    },
    {
      "type": "Feature",
      "geometry": {
        "type": "Point",
        "coordinates": [
          129.143143,
          35.201745
        ]
      },
      "properties": {
        "cw_id": "SAMPLE-21090590-C1",
        "adm_cd": "21090590",
        "gap_s": 3.2,
        "exposure_cnt": 3
      }
    },
    {
      "type": "Feature",
      "geometry": {
        "type": "Point",
        "coordinates": [
          129.142801,
          35.199238
        ]
      },
      "properties": {
        "cw_id": "SAMPLE-21090590-C2",
        "adm_cd": "21090590",
        "gap_s": 4.6,
        "exposure_cnt": 3
      }
    },
    {
      "type": "Feature",
      "geometry": {
        "type": "Point",
        "coordinates": [
          129.141184,
          35.202262
        ]
      },
      "properties": {
        "cw_id": "SAMPLE-21090590-C3",
        "adm_cd": "21090590",
        "gap_s": 4.4,
        "exposure_cnt": 1
      }
    },
    {
      "type": "Feature",
      "geometry": {
        "type": "Point",
        "coordinates": [
          129.155207,
          35.230378
        ]
      },
      "properties": {
        "cw_id": "SAMPLE-21090620-C1",
        "adm_cd": "21090620",
        "gap_s": 6.3,
        "exposure_cnt": 3
      }
    },
    {
      "type": "Feature",
      "geometry": {
        "type": "Point",
        "coordinates": [
          129.153178,
          35.232584
        ]
      },
      "properties": {
        "cw_id": "SAMPLE-21090620-C2",
        "adm_cd": "21090620",
        "gap_s": 1.9,
        "exposure_cnt": 1
      }
    },
    {
      "type": "Feature",
      "geometry": {
        "type": "Point",
        "coordinates": [
          129.15182,
          35.232804
        ]
      },
      "properties": {
        "cw_id": "SAMPLE-21090620-C3",
        "adm_cd": "21090620",
        "gap_s": 2.1,
        "exposure_cnt": 1
      }
    },
    {
      "type": "Feature",
      "geometry": {
        "type": "Point",
        "coordinates": [
          129.128591,
          35.185354
        ]
      },
      "properties": {
        "cw_id": "SAMPLE-21090640-C1",
        "adm_cd": "21090640",
        "gap_s": 5.8,
        "exposure_cnt": 3
      }
    },
    {
      "type": "Feature",
      "geometry": {
        "type": "Point",
        "coordinates": [
          129.129703,
          35.182255
        ]
      },
      "properties": {
        "cw_id": "SAMPLE-21090640-C2",
        "adm_cd": "21090640",
        "gap_s": 2.7,
        "exposure_cnt": 2
      }
    },
    {
      "type": "Feature",
      "geometry": {
        "type": "Point",
        "coordinates": [
          129.125174,
          35.184324
        ]
      },
      "properties": {
        "cw_id": "SAMPLE-21090640-C3",
        "adm_cd": "21090640",
        "gap_s": 3.3,
        "exposure_cnt": 2
      }
    },
    {
      "type": "Feature",
      "geometry": {
        "type": "Point",
        "coordinates": [
          129.135196,
          35.189057
        ]
      },
      "properties": {
        "cw_id": "SAMPLE-21090650-C1",
        "adm_cd": "21090650",
        "gap_s": 2.3,
        "exposure_cnt": 1
      }
    },
    {
      "type": "Feature",
      "geometry": {
        "type": "Point",
        "coordinates": [
          129.132691,
          35.190747
        ]
      },
      "properties": {
        "cw_id": "SAMPLE-21090650-C2",
        "adm_cd": "21090650",
        "gap_s": 6.9,
        "exposure_cnt": 1
      }
    },
    {
      "type": "Feature",
      "geometry": {
        "type": "Point",
        "coordinates": [
          129.133117,
          35.188965
        ]
      },
      "properties": {
        "cw_id": "SAMPLE-21090650-C3",
        "adm_cd": "21090650",
        "gap_s": 5.9,
        "exposure_cnt": 2
      }
    },
    {
      "type": "Feature",
      "geometry": {
        "type": "Point",
        "coordinates": [
          129.178539,
          35.172831
        ]
      },
      "properties": {
        "cw_id": "SAMPLE-21090660-C1",
        "adm_cd": "21090660",
        "gap_s": 6.8,
        "exposure_cnt": 3
      }
    },
    {
      "type": "Feature",
      "geometry": {
        "type": "Point",
        "coordinates": [
          129.174708,
          35.171353
        ]
      },
      "properties": {
        "cw_id": "SAMPLE-21090660-C2",
        "adm_cd": "21090660",
        "gap_s": 3.9,
        "exposure_cnt": 3
      }
    },
    {
      "type": "Feature",
      "geometry": {
        "type": "Point",
        "coordinates": [
          129.174743,
          35.173874
        ]
      },
      "properties": {
        "cw_id": "SAMPLE-21090660-C3",
        "adm_cd": "21090660",
        "gap_s": 1.3,
        "exposure_cnt": 2
      }
    },
    {
      "type": "Feature",
      "geometry": {
        "type": "Point",
        "coordinates": [
          129.184051,
          35.170426
        ]
      },
      "properties": {
        "cw_id": "SAMPLE-21090670-C1",
        "adm_cd": "21090670",
        "gap_s": 3.9,
        "exposure_cnt": 1
      }
    },
    {
      "type": "Feature",
      "geometry": {
        "type": "Point",
        "coordinates": [
          129.18356,
          35.170086
        ]
      },
      "properties": {
        "cw_id": "SAMPLE-21090670-C2",
        "adm_cd": "21090670",
        "gap_s": 2.4,
        "exposure_cnt": 1
      }
    },
    {
      "type": "Feature",
      "geometry": {
        "type": "Point",
        "coordinates": [
          129.182889,
          35.1692
        ]
      },
      "properties": {
        "cw_id": "SAMPLE-21090670-C3",
        "adm_cd": "21090670",
        "gap_s": 2,
        "exposure_cnt": 3
      }
    },
    {
      "type": "Feature",
      "geometry": {
        "type": "Point",
        "coordinates": [
          129.167172,
          35.174956
        ]
      },
      "properties": {
        "cw_id": "SAMPLE-21090680-C1",
        "adm_cd": "21090680",
        "gap_s": 5.9,
        "exposure_cnt": 2
      }
    },
    {
      "type": "Feature",
      "geometry": {
        "type": "Point",
        "coordinates": [
          129.169683,
          35.173936
        ]
      },
      "properties": {
        "cw_id": "SAMPLE-21090680-C2",
        "adm_cd": "21090680",
        "gap_s": 6.9,
        "exposure_cnt": 3
      }
    },
    {
      "type": "Feature",
      "geometry": {
        "type": "Point",
        "coordinates": [
          129.166725,
          35.174626
        ]
      },
      "properties": {
        "cw_id": "SAMPLE-21090680-C3",
        "adm_cd": "21090680",
        "gap_s": 3,
        "exposure_cnt": 3
      }
    },
    {
      "type": "Feature",
      "geometry": {
        "type": "Point",
        "coordinates": [
          129.133006,
          35.205368
        ]
      },
      "properties": {
        "cw_id": "SAMPLE-21090700-C1",
        "adm_cd": "21090700",
        "gap_s": 4.4,
        "exposure_cnt": 1
      }
    },
    {
      "type": "Feature",
      "geometry": {
        "type": "Point",
        "coordinates": [